{
  "$schema": "https://json-schema.org/draft/2020-12/schema",
  "$id": "https://xgen.dev/schemas/variants.schema.json",
  "title": "xgen variants.json (CVA-style recipe)",
  "type": "object",
  "properties": {
    "$schema": {
      "type": "string"
    },
    "id": {
      "type": "string"
    },
    "base": {
      "type": "string"
    },
    "keys": {
      "type": "array",
      "items": {
        "type": "string"
      },
      "uniqueItems": true
    },
    "defaults": {
      "type": "object",
      "additionalProperties": {
        "type": "string"
      }
    },
    "byKey": {
      "type": "object",
      "additionalProperties": {
        "type": "object",
        "additionalProperties": {
          "type": "string"
        }
      }
    },
    "compound": {
      "type": "array",
      "items": {
        "type": "object",
        "properties": {
          "class": {
            "type": "string"
          }
        },
        "required": [
          "class"
        ],
        "additionalProperties": {
          "type": "string"
        }
      }
    }
  },
  "required": [
    "id",
    "base",
    "keys",
    "defaults",
    "byKey"
  ],
  "additionalProperties": false
}