{
  "$schema": "../../schema/schemas/variants.schema.json",
  "id": "one.switcher-item",
  "base": "inline-flex shrink-0 items-center justify-center whitespace-nowrap font-bold text-muted-foreground inset-ring inset-ring-transparent rounded",
  "byKey": {
    "size": {
      "sm": "h-6 gap-1 px-3 text-xs",
      "default": "h-8 gap-2 px-4 text-sm",
      "lg": "h-10 gap-2 px-5 text-sm"
    },
    "state": {
      "default": "",
      "active": "bg-background text-foreground inset-ring-border"
    },
    "layout": {
      "text": "",
      "icon": "[&>svg]:size-4"
    }
  },
  "defaults": {
    "size": "default",
    "state": "default",
    "layout": "text"
  },
  "keys": [
    "size",
    "state",
    "layout"
  ],
  "compound": [
    {
      "layout": "icon",
      "size": "sm",
      "class": "w-6 px-0"
    },
    {
      "layout": "icon",
      "size": "default",
      "class": "w-8 px-0"
    },
    {
      "layout": "icon",
      "size": "lg",
      "class": "w-10 px-0"
    }
  ]
}
