{
  "$schema": "../../schemas/variants.schema.json",
  "id": "ui.iconbadge",
  "base": "inline-flex shrink-0 items-center justify-center rounded-md font-semibold",
  "keys": ["variant", "size"],
  "defaults": {
    "variant": "default",
    "size": "default"
  },
  "byKey": {
    "variant": {
      "default": "bg-muted text-muted-foreground",
      "accent": "bg-accent text-accent-foreground",
      "secondary": "bg-secondary text-secondary-foreground",
      "outline": "border border-border text-foreground",
      "destructive": "bg-destructive text-destructive-foreground"
    },
    "size": {
      "xs": "h-6 w-6 text-xs",
      "sm": "h-8 w-8 text-xs",
      "default": "h-10 w-10 text-sm",
      "lg": "h-12 w-12 text-base"
    }
  }
}
