{
  "id": "ui.title",
  "base": "text-foreground",
  "keys": [
    "size",
    "weight"
  ],
  "defaults": {
    "size": "inherit",
    "weight": "semibold"
  },
  "byKey": {
    "size": {
      "xs": "text-xs",
      "sm": "text-sm",
      "base": "text-base",
      "lg": "text-lg",
      "xl": "text-xl",
      "2xl": "text-2xl",
      "3xl": "text-3xl",
      "4xl": "text-4xl",
      "5xl": "text-5xl",
      "inherit": ""
    },
    "weight": {
      "regular": "font-normal",
      "medium": "font-medium",
      "semibold": "font-semibold",
      "bold": "font-bold"
    }
  }
}
