{
  "id": "ui.image",
  "base": "block max-w-full",
  "keys": [
    "aspect",
    "fit",
    "position",
    "size",
    "variant"
  ],
  "defaults": {
    "aspect": "auto",
    "fit": "cover",
    "position": "center",
    "size": "auto",
    "variant": "default"
  },
  "byKey": {
    "aspect": {
      "auto": "aspect-auto",
      "square": "aspect-square",
      "video": "aspect-video"
    },
    "fit": {
      "contain": "object-contain",
      "cover": "object-cover",
      "fill": "object-fill",
      "none": "object-none",
      "scale-down": "object-scale-down"
    },
    "position": {
      "bottom": "object-bottom",
      "center": "object-center",
      "left": "object-left",
      "left-bottom": "object-left-bottom",
      "left-top": "object-left-top",
      "right": "object-right",
      "right-bottom": "object-right-bottom",
      "right-top": "object-right-top",
      "top": "object-top"
    },
    "size": {
      "auto": "",
      "default": "",
      "full": "h-full w-full",
      "xs": "size-6",
      "sm": "size-8",
      "md": "size-12",
      "lg": "size-16",
      "xl": "size-20"
    },
    "variant": {
      "default": "",
      "logo": "object-contain"
    }
  },
  "compound": []
}
