{
  "id": "ui.radio",
  "base": "shrink-0 appearance-none rounded-full bg-background inset-ring inset-ring-input checked:bg-primary checked:inset-ring-primary radio-glyph disabled:cursor-not-allowed disabled:opacity-50",
  "keys": [
    "size",
    "variant"
  ],
  "defaults": {
    "size": "default",
    "variant": "default"
  },
  "byKey": {
    "size": {
      "default": "size-5 [--dot:10px]",
      "sm": "size-4 [--dot:8px]"
    },
    "variant": {
      "default": "",
      "ghost": "bg-muted"
    }
  }
}
