{
  "id": "ui.fieldset",
  "base": "grid",
  "keys": [
    "size",
    "variant"
  ],
  "defaults": {
    "size": "default",
    "variant": "default"
  },
  "byKey": {
    "size": {
      "default": "gap-2",
      "lg": "gap-4",
      "sm": "gap-2"
    },
    "variant": {
      "card": "rounded p-4 inset-ring inset-ring-border",
      "default": "",
      "inline": "flex flex-wrap items-start gap-4"
    }
  }
}
