{
  "id": "ui.meter",
  "base": "w-full appearance-none overflow-hidden bg-muted progress-bar rounded",
  "keys": [
    "size",
    "variant"
  ],
  "defaults": {
    "size": "default",
    "variant": "default"
  },
  "byKey": {
    "size": {
      "sm": "h-1",
      "default": "h-2",
      "lg": "h-3"
    },
    "variant": {
      "default": "[--bar:var(--color-primary)]",
      "muted": "[--bar:var(--color-muted-foreground)]"
    }
  },
  "compound": []
}
