{
  "id": "ui.disclosure",
  "base": "group",
  "keys": [
    "variant"
  ],
  "defaults": {
    "variant": "default"
  },
  "byKey": {
    "variant": {
      "card": "rounded bg-card inset-ring inset-ring-border",
      "default": "rounded inset-ring inset-ring-border",
      "ghost": "",
      "item": "border-b border-border last:border-b-0"
    }
  }
}
