{
  "id": "ui.badge",
  "base": "inline-flex shrink-0 items-center justify-center whitespace-nowrap font-medium inset-ring rounded-full",
  "keys": [
    "size",
    "variant"
  ],
  "defaults": {
    "size": "default",
    "variant": "default"
  },
  "byKey": {
    "size": {
      "sm": "h-5 px-2 text-xs",
      "default": "h-6 px-3 text-xs",
      "lg": "h-8 px-4 text-sm"
    },
    "variant": {
      "default": "bg-primary text-primary-foreground inset-ring-primary",
      "secondary": "bg-muted text-foreground inset-ring-transparent",
      "outline": "bg-transparent text-foreground inset-ring-border",
      "destructive": "bg-destructive text-white inset-ring-transparent focus-visible:ring-destructive/20 dark:bg-destructive/60 dark:focus-visible:ring-destructive/40"
    }
  },
  "compound": []
}
