{
  "id": "ui.switch",
  "base": "relative shrink-0 appearance-none bg-muted inset-ring inset-ring-input checked:bg-primary checked:inset-ring-primary switch-knob disabled:cursor-not-allowed disabled:opacity-50 rounded-full",
  "keys": [
    "size"
  ],
  "defaults": {
    "size": "default"
  },
  "byKey": {
    "size": {
      "default": "h-5 w-9 [--knob:12px] [--pad:4px]",
      "sm": "h-4 w-8 [--knob:12px] [--pad:2px]"
    }
  }
}
