{
  "$schema": "../../schema/schemas/variants.schema.json",
  "id": "block.section-column",
  "base": "",
  "defaults": {
    "measure": "default"
  },
  "keys": [
    "measure"
  ],
  "compound": [],
  "byKey": {
    "measure": {
      "default": "",
      "landing": "",
      "fill": "",
      "xs": "mx-auto w-full max-w-xs",
      "sm": "mx-auto w-full max-w-sm",
      "md": "mx-auto w-full max-w-md",
      "lg": "mx-auto w-full max-w-lg",
      "xl": "mx-auto w-full max-w-xl",
      "2xl": "mx-auto w-full max-w-2xl",
      "3xl": "mx-auto w-full max-w-3xl"
    }
  }
}
