{
  "id": "ui.link",
  "base": "inline-flex items-center underline-offset-4",
  "keys": [
    "size",
    "variant"
  ],
  "defaults": {
    "size": "default",
    "variant": "default"
  },
  "byKey": {
    "size": {
      "sm": "gap-2 text-sm font-medium",
      "default": "gap-2 text-base font-semibold",
      "md": "gap-2 text-xl font-semibold",
      "lg": "gap-2 text-2xl font-semibold"
    },
    "variant": {
      "block": "flex w-full text-foreground",
      "default": "text-foreground hover:underline",
      "external": "text-foreground hover:underline",
      "muted": "text-muted-foreground hover:text-foreground",
      "nav": "text-foreground"
    }
  }
}
